2024-02-14 00:13:13,2024-02-14 00:39:59,0,100,1606,1,2024-02-14 00:40:00,"R_3DnXnOcMZrEbAKN","anonymous","EN",1,NA,"Taiwan",2,"Chinese (traditional)",2,5,2,"",1,3,4,1,3,3,3,3,3,NA,NA,NA,NA,NA,NA,NA,NA,NA,2,3,3,4,3,3,2,3,3,NA,NA,NA,2,2,4,2,4,4,3,4,4,NA,NA,NA,3,4,3,3,3,3,NA,NA,NA,3,3,3,NA,NA,NA,NA,NA,NA,NA,NA,NA,NA,NA,NA,6,3,4,NA,NA,NA,NA,NA,NA,NA,NA,NA,NA,NA,NA,NA,NA,NA,5,4,3,5,3,3,NA,NA,NA,5,2,3,6,4,3,5,3,3,NA,NA,NA,NA,NA,NA,"","","","","","","","","#1 (related to #3)","","","",16,6,12,NA,NA,NA,1,3,17,NA,4,14,15,NA,2,5,NA,7,NA,NA,NA,NA,13,NA,NA,NA,NA,NA,11,18,NA,10,8,9,NA,NA
2024-02-14 01:31:03,2024-02-14 02:15:05,0,100,2642,1,2024-02-14 02:15:05,"R_3f3Qe34BTiQnB62","anonymous","EN",1,NA,"United States",1,"",3,2,2,"These descriptions seem solid.",NA,NA,NA,1,4,NA,1,3,NA,NA,NA,NA,1,3,NA,NA,NA,NA,2,4,NA,6,3,NA,2,3,NA,2,5,NA,2,3,NA,2,3,NA,NA,NA,NA,NA,NA,NA,3,5,NA,5,5,NA,NA,NA,NA,NA,NA,NA,NA,NA,NA,6,4,NA,NA,NA,NA,NA,NA,NA,NA,NA,NA,NA,NA,NA,4,3,NA,NA,NA,NA,3,5,NA,NA,NA,NA,NA,NA,NA,3,NA,NA,NA,NA,NA,NA,NA,NA,6,4,NA,2,2,NA,NA,NA,NA,6,4,NA,"My initial sense is that #4 is not as great a measure of the construct as the others. I think this is because the concepts of respect and face are so closely linked.","","I initially thought that #2 was perhaps not a great measure of the construct, but when reflecting on why this is the case, I couldn't come up with a solid reason. I think it stands out (followed by #6 as a close second) for being about action not directed towards an individual, whereas the rest of the items are about action towards an individual.  Not sure if that's a valid reason for it to be a less better measure of the construct, however.","","#3 seems to be less about the self than the others. It feels more like an honor, other-concern item.","","#6 stands out for not referring to one's in-group. This seems to violate the description of the construct (focus on group honor, protecting in-group reputation).","","#6 seems to be more of a face, other-concern type item (the wording reflects other people vs self). #5 seems to get at the same notion, but is more self focused. Also, I don't like the idea of ""doing something well"" as face preserving; not if one didn't give max effort (see below).","what about the idea of giving full, 100% effort in fulfilling one's obligations? For a person concerned with preserving self face/status, it's perhaps less about doing something well than doing it to your maximum capability - that is, failing but knowing one gave one's best effort would preserve face; similarly, ""doing something well"" in the eyes of others, but giving less than 100% effort might not be self face preserving.","these seem pretty solid to me.","",NA,16,8,NA,6,NA,18,17,15,2,13,10,NA,NA,14,3,NA,NA,NA,11,NA,NA,NA,NA,7,NA,4,NA,NA,1,NA,NA,5,9,NA,12
2024-02-14 05:31:14,2024-02-14 05:39:17,0,100,482,1,2024-02-14 05:39:18,"R_4CDg8oaldVZ6jCk","anonymous","EN",1,NA,"Australia",1,"",3,3,3,"",1,3,NA,NA,NA,NA,NA,NA,NA,1,4,NA,NA,NA,NA,1,3,NA,NA,NA,NA,NA,NA,NA,NA,NA,NA,NA,NA,NA,NA,NA,NA,NA,NA,NA,3,3,NA,3,3,NA,NA,NA,NA,NA,NA,NA,4,3,NA,2,3,NA,NA,NA,NA,NA,NA,NA,4,4,NA,4,3,NA,4,3,NA,3,3,NA,NA,NA,NA,5,3,NA,NA,NA,NA,5,3,NA,5,3,NA,NA,NA,NA,6,3,NA,6,3,NA,NA,NA,NA,NA,NA,NA,6,3,NA,NA,NA,NA,"","","These seem less clear People should be treated with respect, no matter who they are -- 'who they are' = confusing
People should keep the secrets they have been trusted with, no matter whose secret it is - seems like a self-honouring thing","","","","Men should protect the reputation of women they are related to - this is the only gendered item - introduces sexist norms?","","","","","",17,NA,NA,2,NA,11,NA,NA,NA,NA,NA,NA,9,16,NA,NA,6,4,1,NA,5,18,12,14,NA,15,NA,8,10,NA,7,3,NA,NA,13,NA
2024-02-14 10:43:55,2024-02-14 11:04:35,0,100,1239,1,2024-02-14 11:04:36,"R_44iphWor7YEhBZ4","anonymous","EN",1,NA,"United Kingdom",1,"",1,1,1,"",3,3,NA,NA,NA,NA,3,4,NA,NA,NA,NA,NA,NA,NA,NA,NA,NA,2,3,NA,2,3,NA,2,3,NA,1,5,NA,NA,NA,NA,NA,NA,NA,NA,NA,NA,1,3,NA,3,4,NA,NA,NA,NA,NA,NA,NA,2,3,NA,NA,NA,NA,4,4,NA,4,5,NA,NA,NA,NA,NA,NA,NA,NA,NA,NA,4,4,NA,1,2,NA,NA,NA,NA,1,3,NA,NA,NA,NA,5,3,NA,NA,NA,NA,6,3,NA,6,5,NA,NA,NA,NA,NA,NA,NA,6,5,NA,"People?s opinions should be independent of what others around them think.

This item seems to be less about internal worth than the others. It could also be misconstrued as meaning that people should have opinions that are different to others.","","People should not lie to another person, no matter who that person is

The act of lying seems more focused on the liar, i.e., on their choice to lie than on what it might imply about the other person. This is also differently valenced to the items about keeping secrets/promises.","","People should punish those who insult them

I had this item to respond to and I found it hard to decide if it was self-concern or other-concern. Also, being able to punish others implies some position of power which may not apply to all situations.","","A person cannot be respected if they are not true to their word

I would find it hard to work out if this item was self-concern or other-concern.","","People should control their behavior in front of others

I found it hard to categorise this one as ""behavior"" is so broad.","For this item ""People should avoid situations where they could be embarrassed"" there are lots of situations where embarrassment might happen  which are about a group rather than the self. I wonder if it might be better if this item were phrased as ""People should avoid situations where they could look incompetent.""","","People should avoid making others look incompetent.
",11,NA,10,NA,NA,NA,4,16,3,7,NA,NA,NA,6,2,NA,NA,17,NA,5,18,NA,NA,NA,1,15,NA,12,NA,14,NA,13,8,NA,NA,9
2024-02-14 10:15:42,2024-02-14 11:10:43,0,100,3301,1,2024-02-14 11:10:44,"R_55t1jVcmNYAlVZJ","anonymous","EN",1,NA,"Italy",2,"Italian",4,1,1,"",NA,NA,NA,NA,NA,NA,1,4,2,NA,NA,NA,NA,NA,NA,1,4,2,2,3,1,NA,NA,NA,NA,NA,NA,2,5,1,NA,NA,NA,2,4,2,NA,NA,NA,NA,NA,NA,NA,NA,NA,3,4,1,5,3,1,3,4,1,4,4,2,6,4,2,4,4,2,NA,NA,NA,NA,NA,NA,NA,NA,NA,6,3,2,5,2,1,3,4,2,NA,NA,NA,NA,NA,NA,NA,NA,NA,5,4,1,5,4,3,6,4,2,3,2,2,NA,NA,NA,NA,NA,NA,"Item number 4 seems to be slightly less centered on the dimension compared to the other items. I would find it effective if taken alone.","","Item 5 seems a bit off-topic. In my opinion, it also touches on other dimensions. Let's consider the potential implications of keeping any sort of secrets disclosed by any type of person. A negative response, or disagreement with this assertion, might be due to worrying about the consequences and not necessarily a reflection of concern for others dignity.","","Item 5. After a couple of readings, it makes me think about face self-concern, while the other items do not raise any doubts.","","Item 5 may tap on to face other-concern dimension","","Item 1 sounds a bit too generic, it could be related also to honor self-concern dimension","","Item 3 could be related also to face self-concern dimension","People should minimize conflict in social relationships at all costs, to preserve the group's status",NA,NA,2,NA,NA,11,5,NA,NA,6,NA,10,NA,NA,NA,1,12,3,13,15,17,NA,NA,NA,7,18,16,NA,NA,NA,14,8,9,4,NA,NA
2024-02-14 12:00:51,2024-02-14 12:21:54,0,100,1262,1,2024-02-14 12:21:54,"R_2977XHvBTMXGZZD","anonymous","EN",1,NA,"Greece",2,"Greek (but I can also run the project in English)",3,3,3,"They look ok!",NA,NA,NA,3,3,3,1,3,3,NA,NA,NA,1,3,3,NA,NA,NA,NA,NA,NA,NA,NA,NA,NA,NA,NA,2,3,3,4,3,3,NA,NA,NA,3,3,3,4,3,3,NA,NA,NA,NA,NA,NA,NA,NA,NA,NA,NA,NA,4,3,3,NA,NA,NA,4,3,3,NA,NA,NA,6,3,3,NA,NA,NA,6,3,3,6,3,3,NA,NA,NA,6,3,3,NA,NA,NA,5,3,3,4,3,3,NA,NA,NA,6,3,3,NA,NA,NA,6,3,3,1,3,3,"","","","","","","","","","","","",NA,8,4,NA,6,NA,NA,NA,NA,16,14,NA,1,10,NA,NA,NA,NA,18,NA,15,NA,12,NA,11,2,NA,3,NA,9,7,NA,5,NA,17,13
2024-02-14 10:36:13,2024-02-14 12:41:41,0,100,7528,1,2024-02-14 12:41:42,"R_3fAG0lt6ZY7sbVv","anonymous","EN",1,NA,"Hungary",2,"Hungarian",3,1,2,"",NA,NA,NA,1,4,2,NA,NA,NA,1,4,3,1,4,2,1,5,2,NA,NA,NA,NA,NA,NA,NA,NA,NA,NA,NA,NA,2,2,2,2,4,2,4,4,3,NA,NA,NA,NA,NA,NA,3,4,2,5,2,1,NA,NA,NA,4,3,3,NA,NA,NA,NA,NA,NA,6,3,2,4,2,4,3,4,2,NA,NA,NA,NA,NA,NA,5,3,1,NA,NA,NA,5,3,2,NA,NA,NA,6,4,2,NA,NA,NA,NA,NA,NA,6,1,1,6,2,2,NA,NA,NA,"","","","People should always keep promises that they made to another person, no matter who that person is: this is I think to close to someone 'honoring' their word","","If a person is insulted and they don?t respond, they will look weak: This is I think too close to saving 'face'","Men should protect the reputation of women they are related to: These are also role expectations, in this form I think this item cannot separate between face and honor","","","","","",NA,16,NA,6,15,1,NA,NA,NA,NA,8,18,5,NA,NA,17,3,NA,2,NA,NA,14,4,13,NA,NA,7,NA,11,NA,12,NA,NA,9,10,NA
2024-02-14 12:04:26,2024-02-14 13:33:22,0,100,5335,1,2024-02-14 13:33:24,"R_4NDkqhqO6UqUplb","anonymous","EN",1,NA,"Türkiye",2,"Turkish",2,2,2,"",3,3,2,NA,NA,NA,NA,NA,NA,5,3,2,NA,NA,NA,2,4,2,2,2,2,2,4,2,2,4,2,NA,NA,NA,NA,NA,NA,2,4,2,NA,NA,NA,NA,NA,NA,3,2,4,6,4,2,3,4,2,6,2,2,NA,NA,NA,4,4,2,NA,NA,NA,4,3,1,NA,NA,NA,2,4,4,NA,NA,NA,NA,NA,NA,3,4,2,NA,NA,NA,5,3,2,NA,NA,NA,NA,NA,NA,1,3,2,NA,NA,NA,6,3,2,NA,NA,NA,NA,NA,NA,"","","","","","","","","","","","",9,NA,NA,7,NA,15,14,2,6,NA,NA,12,NA,NA,3,16,4,13,NA,8,NA,5,NA,1,NA,NA,18,NA,17,NA,NA,11,NA,10,NA,NA
2024-02-14 14:54:40,2024-02-14 15:19:56,0,100,1516,1,2024-02-14 15:19:57,"R_8CdOn8SeY5W93jz","anonymous","EN",1,NA,"Poland",2,"Polish",2,2,2,"The descriptions are quite general. I'm afraid that it will be easy to take honor for face and vice-versa. Reputation sometimes is intertwined with the social role we occupy.",NA,NA,NA,NA,NA,NA,1,4,2,1,4,1,1,3,1,NA,NA,NA,3,4,1,NA,NA,NA,3,4,1,NA,NA,NA,NA,NA,NA,2,3,1,3,5,1,3,4,1,3,4,1,NA,NA,NA,NA,NA,NA,NA,NA,NA,NA,NA,NA,4,NA,1,4,4,1,4,4,2,4,3,1,NA,NA,NA,NA,NA,NA,5,3,1,NA,NA,NA,NA,NA,NA,NA,NA,NA,5,3,2,NA,NA,NA,NA,NA,NA,NA,NA,NA,6,3,1,4,4,2,6,3,1,"3 - this one is too similar to honor in my opinion. Is more ""pro-active"" compared to other items.","","","","I have problems with items that explicitly name ""honor"". I would use ""reputation instead. These are tautologies, the items are circular, they self-describe the factor they are referring to. Sorry for this muddy explanation, but I have no better words to explain my intuition:P","","6 - It is probably the least ""social"" one. Sometimes ""the word"" is not related to others. You can, for example, give yourself a word, that you will start dieting next week.","","1,2,4, - I think I have problems in distinguishing these items from honor. To me these are all reputation-related. Maybe it's my culture, but embarrasing oneself, to me, is associated with losing reputation. Cauce you might be perceived as someone unpredictable, not worthy of concern, a poor cooperation partner.","","4 - this one, to me, is about respecting ones ingroup. Therefore, very similar to the honor category","",NA,NA,6,4,1,NA,3,NA,2,NA,NA,12,13,15,17,NA,NA,NA,NA,11,18,10,14,NA,NA,7,NA,NA,NA,9,NA,NA,NA,8,5,16
2024-02-13 22:30:45,2024-02-14 16:12:51,0,100,63725,1,2024-02-14 16:12:52,"R_4fjZBx022odWFwG","anonymous","EN",1,NA,"Turkey",2,"Turkish",3,1,2,"",3,3,1,1,4,1,NA,NA,NA,NA,NA,NA,NA,NA,NA,1,4,1,NA,NA,NA,2,4,1,NA,NA,NA,2,5,1,2,4,1,NA,NA,NA,NA,NA,NA,NA,NA,NA,NA,NA,NA,5,3,1,3,3,1,3,3,1,4,4,1,NA,NA,NA,NA,NA,NA,NA,NA,NA,NA,NA,NA,3,3,1,5,3,1,NA,NA,NA,3,4,1,5,5,1,3,3,1,NA,NA,NA,6,3,1,3,3,1,3,3,2,NA,NA,NA,NA,NA,NA,NA,NA,NA,"","Item 1: I would drop the ""and"" and put a comma (,) after ""opinion""","My candidates for exclusion are items number 1 and 3. One of them can be dropped because their meanings and sentence structures are very similar.","","","","Items 6 and 7: They seem to be measuring ""honor, concern for others"" rather than ""honor, concern for self. So, I recommend dropping them.
","?tem 4: I think gender is a strong confounding in this item. Rewriting it in a gender-neutral form would be a good option, like the remaining items. But please note that I am not an expert in this line of research. So it may be the standard item in this literature. If so, please excuse my ignorance.","","","","It seems that I have grouped some of the items of the Face construct (both self-concerned and other-concerned) under the honor construct. Especially, the word ""embarrass"" has confused me. In retrospect, the items make sense though.",7,16,NA,NA,NA,17,NA,6,NA,3,14,NA,NA,NA,NA,15,10,9,18,NA,NA,NA,NA,12,11,NA,1,2,4,NA,5,13,8,NA,NA,NA
2024-02-14 16:25:04,2024-02-14 16:37:27,0,100,743,1,2024-02-14 16:37:28,"R_6wBshd83SOKZ4E9","anonymous","EN",1,NA,"Portugal",2,"Portuguese",4,2,3,"",NA,NA,NA,1,4,2,NA,NA,NA,NA,NA,NA,NA,NA,NA,1,4,2,NA,NA,NA,NA,NA,NA,NA,NA,NA,NA,NA,NA,2,3,2,NA,NA,NA,3,5,1,3,4,2,NA,NA,NA,4,4,1,3,4,1,NA,NA,NA,4,4,2,NA,NA,NA,NA,NA,NA,NA,NA,NA,NA,NA,NA,2,4,2,4,4,2,6,4,1,6,4,2,6,3,2,5,3,2,5,4,2,6,4,2,6,2,2,NA,NA,NA,NA,NA,NA,NA,NA,NA,6,5,2,"","","","","","","","","","","","",NA,9,NA,NA,NA,2,NA,NA,NA,NA,6,NA,11,15,NA,14,3,NA,16,NA,NA,NA,NA,17,18,10,4,7,1,13,5,8,NA,NA,NA,12
2024-02-14 22:13:50,2024-02-14 22:39:38,0,100,1547,1,2024-02-14 22:39:39,"R_5Q2TesAYlWycYZb","anonymous","EN",1,NA,"GREECE",2,"GREEK",3,1,1,"",NA,NA,NA,1,4,1,1,4,1,1,3,1,2,4,1,NA,NA,NA,2,4,1,NA,NA,NA,NA,NA,NA,2,4,1,NA,NA,NA,NA,NA,NA,NA,NA,NA,3,5,1,NA,NA,NA,5,4,1,5,4,1,NA,NA,NA,NA,NA,NA,6,4,1,NA,NA,NA,6,4,1,NA,NA,NA,4,4,1,6,4,1,5,4,1,NA,NA,NA,NA,NA,NA,4,4,1,5,5,1,NA,NA,NA,NA,NA,NA,NA,NA,NA,4,4,1,NA,NA,NA,6,4,1,"","","2. People should never talk about others behind their back in a negative way. 
It is my understanding that this item is more focused on preserving others' face and status, rather than focused on a universalistic morality in the treatment of others. Not talking negatively about others might serve as a universal value, but the association that first comes to mind is that it is a value directed at preserving one's face.","perhaps change the verb talk with another, less ambiguous, action.","","","","","","","","",NA,2,1,12,10,NA,17,NA,NA,8,NA,NA,NA,6,NA,18,7,NA,NA,13,NA,14,NA,4,16,15,NA,NA,3,5,NA,NA,NA,11,NA,9
2024-02-14 22:44:31,2024-02-14 23:04:28,0,100,1197,1,2024-02-14 23:04:29,"R_5pgK0LuJQORfNkE","anonymous","EN",1,NA,"USA",1,"",3,1,1,"I'm new to some of these constructs, so these might not be helpful. I was struck the the self-concern and other-concern definitions for Dignity don't seem to be defined using the same terms. Why does the self-concern definition not mention how the self is treated by others?",1,5,NA,NA,NA,NA,NA,NA,NA,NA,NA,NA,NA,NA,NA,1,5,NA,NA,NA,NA,1,4,NA,3,5,NA,NA,NA,NA,3,5,NA,2,4,NA,3,5,NA,NA,NA,NA,3,5,NA,NA,NA,NA,NA,NA,NA,5,4,NA,6,5,NA,NA,NA,NA,6,5,NA,NA,NA,NA,4,5,NA,NA,NA,NA,NA,NA,NA,NA,NA,NA,5,5,NA,5,5,NA,NA,NA,NA,NA,NA,NA,5,4,NA,3,2,NA,6,5,NA,NA,NA,NA,5,3,NA,NA,NA,NA,"I don't think any shouldn't be used, but I liked the ones that specified ""worth"" more than the ones that didn't.","Item 4 has a typo, should be ""How much a person respects themself..."" not ""themselves"" which is the plural.
","Item one and 5 could cross-load with Face because it seems like a promise is a ""role"" of a kind.","Maybe something face valid, like, ""People should make sure that they treat everyone with dignity""","Item 3 could confound looking weak because they are insulted and looking weak because they don't respond.","","I don't like item 4 because it taps into gender roles and could reflect sexism where no other items do. I also don't think that item 6 fits in the other category, feels like it should be in the self category?","","","I'm not entirely sure how the embarrassment connects to social roles?","I don't see Item 1 as fitting here well. It feels like humility is about how the self would look, so people who aren't humble are judged for being arrogant, might not reflect as well on the group. I also don't live item 4 because it doesn't talk about the group's reputation/face","",6,NA,NA,NA,NA,16,NA,7,10,NA,8,17,9,NA,5,NA,NA,3,12,NA,11,NA,2,NA,NA,NA,13,15,NA,NA,18,4,14,NA,1,NA
2024-02-15 06:18:19,2024-02-15 07:02:43,0,100,2663,1,2024-02-15 07:02:44,"R_4SfytHqA18R8mfv","anonymous","EN",1,NA,"Hong Kong",2,"Cantonese",3,3,3,"For face, it seems in principle possible that the two conditions of a person's worth are independent of each other, e.g., having a low status but well fulfilling one's duties, or the other way around.",NA,NA,NA,NA,NA,NA,1,4,3,NA,NA,NA,NA,NA,NA,1,4,3,3,3,3,NA,NA,NA,NA,NA,NA,NA,NA,NA,3,3,3,1,3,3,NA,NA,NA,NA,NA,NA,NA,NA,NA,3,5,3,3,5,3,3,4,3,NA,NA,NA,3,3,3,6,4,3,3,2,3,NA,NA,NA,3,5,3,NA,NA,NA,NA,NA,NA,5,3,3,5,NA,3,NA,NA,NA,NA,NA,NA,3,4,3,NA,NA,NA,NA,NA,NA,5,3,3,6,3,3,5,3,3,"I think 3 may be also applicable also to honor self-concern, because a person earns others' respect by being true to themselves, instead of pleasing others.","","I am not sure about 2. Could it be also about preserving other's face and status?","","I think they are all good.","","I thought that 5 can be also about self-concern because this affects their own reputation, not only of his wife, mother, or sister. 

I think 6 should be about self-concern.","","all good.","","good","",NA,NA,2,NA,NA,4,18,NA,NA,NA,6,17,NA,NA,NA,7,8,15,NA,12,5,13,NA,1,NA,NA,14,11,NA,NA,9,NA,NA,16,10,3
2024-02-14 20:59:21,2024-02-15 10:53:28,0,100,50047,1,2024-02-15 10:53:29,"R_3z7wka8WCAfpsEV","anonymous","EN",1,NA,"United States",1,"",3,3,2,"",1,4,NA,NA,NA,NA,1,3,NA,1,4,NA,1,2,NA,NA,NA,NA,2,3,NA,2,3,NA,2,3,NA,2,3,NA,NA,NA,NA,2,3,NA,NA,NA,NA,NA,NA,NA,3,2,NA,NA,NA,NA,NA,NA,NA,1,2,NA,NA,NA,NA,4,3,NA,4,4,NA,6,2,NA,4,3,NA,NA,NA,NA,NA,NA,NA,NA,NA,NA,NA,NA,NA,NA,NA,NA,NA,NA,NA,NA,NA,NA,NA,NA,NA,NA,NA,NA,6,3,NA,6,3,NA,6,2,NA,NA,NA,NA,"don't use: ""How much a person respects themselves is far more important than how much others respect them""

","for all items, the items would be clearer if posed in the 'you' and not 'people' (e.g. Your sense of worth... instead of ""A person's sense of worth...)","","","A person must show strength to be respected","change all 'people' to 'you' to make the items more clearly self-concern (e.g. you should not expect... instead of people should not expect","Men should protect the reputation of women they are related to","most of the self-concerned items explicitly mention honor, but none of the other-concerned do, they all mention 'reputation'. Is this intentional?","","change 'people' and 'a person' to you for all self-concerned items (e.g. You cannot respect yourself instead of A person cannot respect themselves...)","","all items use the term 'people' except ""It is important to maintain harmony within one?s group"", is this by design?",7,NA,18,11,17,NA,8,6,1,3,NA,13,NA,NA,16,NA,NA,5,NA,10,4,15,2,NA,NA,NA,NA,NA,NA,NA,NA,NA,12,9,14,NA
2024-02-15 11:42:12,2024-02-15 12:06:06,0,100,1433,1,2024-02-15 12:06:07,"R_7VWJCc6PRdUGKqJ","anonymous","EN",1,NA,"Italy",2,"Italian",1,1,1,"",1,3,2,1,3,2,NA,NA,NA,1,2,2,2,3,2,2,4,2,NA,NA,NA,NA,NA,NA,2,3,2,NA,NA,NA,NA,NA,NA,2,4,2,3,4,2,NA,NA,NA,NA,NA,NA,4,2,2,3,4,2,4,4,2,4,4,2,NA,NA,NA,NA,NA,NA,4,4,2,NA,NA,NA,4,4,2,NA,NA,NA,NA,NA,NA,NA,NA,NA,6,3,2,NA,NA,NA,NA,NA,NA,5,4,2,NA,NA,NA,NA,NA,NA,2,3,2,2,3,2,NA,NA,NA,"I would drop either item 2 or 3 because I feel they are very similar (together they are redundant).","None.","I would drop one of 2 and 5 for redundancy reasons.","None","I would drop 4, I think many persons do not respond to insult because they are ""good person"" not because they are weak, but I see also that you assess ""looking weak"" not ""being weak"".","none","Drop 7 because of redundancy with 1; drop 3 because 5 includes 3.","None","I would drop 2 because of 1 being included. 5 and 6 look very similar, maybe one of them is enough.","None","2 and 5 look very similar. Also 1 3 and 4 look very simlar.","None",5,1,NA,7,4,8,NA,NA,9,NA,NA,2,17,NA,NA,3,11,6,13,NA,NA,18,NA,12,NA,NA,NA,14,NA,NA,15,NA,NA,16,10,NA
2024-02-15 13:39:50,2024-02-15 13:48:33,0,100,523,1,2024-02-15 13:48:34,"R_3e4MVv5tzuDXLVG","anonymous","EN",1,NA,"Portugal",2,"European Portugueses",2,1,2,"",5,3,1,NA,NA,NA,6,4,3,6,4,1,NA,NA,NA,5,3,2,2,5,1,2,5,1,5,5,1,2,5,1,6,3,2,NA,NA,NA,3,5,1,NA,NA,NA,NA,NA,NA,3,4,1,1,4,1,NA,NA,NA,4,5,1,NA,NA,NA,4,4,1,NA,NA,NA,NA,NA,NA,NA,NA,NA,NA,NA,NA,NA,NA,NA,2,4,2,NA,NA,NA,NA,NA,NA,NA,NA,NA,2,5,1,2,5,1,NA,NA,NA,NA,NA,NA,NA,NA,NA,5,4,1,"","","","","","","","","","","","",9,NA,1,17,NA,12,15,7,16,8,11,NA,2,NA,NA,6,10,NA,4,NA,13,NA,NA,NA,NA,NA,18,NA,NA,NA,14,5,NA,NA,NA,3
2024-02-15 13:03:21,2024-02-15 19:31:17,0,100,23276,1,2024-02-15 19:31:18,"R_4e4ybk4wfBIF0Kg","anonymous","EN",1,NA,"Turkey",2,"Turkish",2,1,1,"",NA,NA,NA,NA,NA,NA,1,3,1,NA,NA,NA,NA,NA,NA,NA,NA,NA,2,4,1,2,4,1,NA,NA,NA,2,5,1,2,5,1,NA,NA,NA,NA,NA,NA,2,3,1,2,1,1,NA,NA,NA,NA,NA,NA,NA,NA,NA,NA,NA,NA,4,4,1,4,4,1,NA,NA,NA,4,4,1,NA,NA,NA,4,2,1,3,4,1,6,3,1,NA,NA,NA,6,2,1,5,3,1,NA,NA,NA,5,4,1,6,5,1,NA,NA,NA,NA,NA,NA,6,4,1,"Item number 1 or 5 can be removed because they are so similar. Maybe item 1 should stay as it gives more info about a possible behavior than simply having an independent opinion.","","Item number 4 can be removed as it is too general in the sense of showing respect. The other items are more specific so they can measure the construct better.","","Since respect was emphasized in the items, I tended to select the dignity and other-concern constructs. Especially 2. item sounded like a universal morality rule to me so I suggest the removal of item 2.","","These items (see below) should not be used:
Men should protect the reputation of women they are related to; feminist participants, even if they agree with the statement in terms of honor, may not still support it as it sounds too traditional.
A person cannot be respected if they are not true to their word; I did not understand why this item is about group honor. It sounds like it relates to self-concern rather than ingroup reputation.","","Sentences starting with people confused me because then I was not sure if we were talking about the face of an individual or a group.
I think the item 2 or 4 should be removed, as they are very similar. I think 2 can be removed because item 4 also covers speaking to not embarrass themselves.","","All items seem valid.","",NA,NA,10,NA,NA,NA,4,8,NA,7,16,NA,NA,15,18,NA,NA,NA,NA,3,17,NA,1,NA,13,11,6,NA,5,9,NA,14,2,NA,NA,12
2024-02-15 20:54:20,2024-02-15 21:11:53,0,100,1053,1,2024-02-15 21:11:54,"R_2n76KZA5XX7VmYp","anonymous","EN",1,NA,"Poland",2,"Polish",1,1,1,"no",NA,NA,NA,1,4,1,NA,NA,NA,NA,NA,NA,1,3,1,NA,NA,NA,NA,NA,NA,NA,NA,NA,NA,NA,NA,NA,NA,NA,NA,NA,NA,2,4,1,NA,NA,NA,2,3,1,3,3,1,NA,NA,NA,NA,NA,NA,1,3,1,NA,NA,NA,4,4,1,NA,NA,NA,4,4,1,4,4,1,3,4,1,5,2,1,3,4,1,NA,NA,NA,5,4,1,5,3,1,5,3,1,NA,NA,NA,NA,NA,NA,2,2,1,2,4,1,2,3,1,NA,NA,NA,"1 and 5 are too similar,","no","no","no","no","no","these are the worst: A person cannot be respected if they are not true to their word,
A person cannot be respected if they are not loyal to their family","no","no","no","no","no",NA,15,NA,NA,17,NA,NA,NA,NA,NA,NA,16,NA,8,3,NA,NA,7,NA,14,NA,10,5,18,2,1,NA,11,13,4,NA,NA,9,12,6,NA
2024-02-15 21:08:38,2024-02-15 21:32:25,0,100,1427,1,2024-02-15 21:32:26,"R_1MWGQsDMYP9uWhP","anonymous","EN",1,NA,"United Kingdom",1,"",4,3,2,"",NA,NA,NA,1,4,NA,2,4,NA,1,4,NA,NA,NA,NA,NA,NA,NA,2,4,NA,NA,NA,NA,2,4,NA,NA,NA,NA,2,3,NA,2,4,NA,NA,NA,NA,NA,NA,NA,3,4,NA,NA,NA,NA,NA,NA,NA,NA,NA,NA,NA,NA,NA,4,4,NA,4,4,NA,3,5,NA,4,4,NA,3,2,NA,NA,NA,NA,NA,NA,NA,NA,NA,NA,6,4,NA,NA,NA,NA,NA,NA,NA,NA,NA,NA,5,4,NA,5,5,NA,5,4,NA,NA,NA,NA,6,4,NA,"This item ?People?s opinions should be independent of what others around them think? seems very leading and ?political?","","This item could have sone overlapping with one?s sense of honor ? People should keep the secrets they have been trusted with, no matter whose secret it is?","","?A person who has no honor is not worthy of respect? reads like ?a person who has not honor is not worthy of honor?.","For this item, expressions like ?take revenge? or ? get back at? could be more helpful. ?People should punish those who insult them?","The other version of this item (item 1)  is better worded ? People should be concerned about damaging their families? reputation?","","This is perhaps the most vague item in the set open to various interpretations ? People should know what is expected of them and act accordingly?","","Item 6 is better worded than the following ? People should be extremely careful not to embarrass other people, especially if it is someone of a higher rank?","",NA,13,1,5,NA,NA,11,NA,16,NA,4,18,NA,NA,17,NA,NA,NA,NA,3,15,8,2,12,NA,NA,NA,6,NA,NA,NA,10,7,9,NA,14
2024-02-16 11:20:10,2024-02-16 11:28:59,0,100,528,1,2024-02-16 11:29:00,"R_3xzYqMpSX9bF29a","anonymous","EN",1,NA,"Poland",2,"Polish, Turkish, Russian",3,2,2,"",NA,NA,NA,1,4,3,1,4,1,NA,NA,NA,1,4,1,1,4,1,NA,NA,NA,NA,NA,NA,2,4,1,NA,NA,NA,NA,NA,NA,2,4,1,3,3,1,NA,NA,NA,3,4,1,NA,NA,NA,5,4,1,3,3,1,4,4,1,NA,NA,NA,NA,NA,NA,NA,NA,NA,4,4,1,NA,NA,NA,4,4,1,NA,NA,NA,5,3,1,6,4,1,6,4,1,5,4,1,NA,NA,NA,NA,NA,NA,NA,NA,NA,NA,NA,NA,4,4,1,NA,NA,NA,"","","","","","","","","","","","",NA,7,9,NA,15,13,NA,NA,6,NA,NA,10,5,NA,3,NA,16,1,4,NA,NA,NA,12,NA,14,NA,2,11,8,17,NA,NA,NA,NA,18,NA
