2024-02-13 07:00:22,2024-02-13 08:09:13,0,100,4130,1,2024-02-13 08:09:14,"R_4GvKq1q3j0U4qA4","anonymous","EN",1,NA,"Singapore",1,"",2,2,2,"",1,4,NA,1,4,NA,NA,NA,NA,NA,NA,NA,NA,NA,NA,NA,NA,NA,4,4,NA,6,2,NA,NA,NA,NA,2,3,NA,4,3,NA,2,4,NA,NA,NA,NA,NA,NA,NA,3,3,NA,NA,NA,NA,5,3,NA,NA,NA,NA,NA,NA,NA,6,2,NA,4,4,NA,4,3,NA,6,4,NA,NA,NA,NA,NA,NA,NA,3,2,NA,NA,NA,NA,4,2,NA,NA,NA,NA,NA,NA,NA,NA,NA,NA,3,2,NA,6,4,NA,NA,NA,NA,NA,NA,NA,6,3,NA,"My understanding of ""dignity"" is that it's about inner worth and value. Item ""1"" and ""5"" seem slightly further away from this definition as they're about whether we should consider others' opinions. We could see ourselves as having innate and independent worth while still considering others' opinions in our decisions, so these items may not measure the construct as well (item 1 in particular).","","In general, I find it a little hard to differentiate some of these items from the 'honor' and 'face' dimensions. Perhaps I may have misunderstood the constructs a little, but for example:

Item 1 feels like it could fall under 'honor' (protecting reputation by keeping promises made to others) or 'face' (fulfilling expectations by keeping the promises you made. 

Items 4 and 6 are the only items I feel unambiguously fall under 'dignity other-concern'.","People are equally valuable no matter who they are, or where they are from.
People are equally worthy of respect regardless of their beliefs or lifestyle.","I am not too sure, but some of the items have an 'aggressive' aspect to it (e.g., items 1, 2 and 4). I wonder if these could cluster into a separate construct.","","Items 6 and 7 can be dropped in my view as the remaining 5 items seem to capture the construct more clearly.","","Item 5 - isn't 'face' inherently about respect from others rather than self-respect?","","Item 1 - hard to differentiate between 'self-concern' or 'other-concern' here. I could argue that this item also taps on 'face - self-concern' as it's about being humble to protect one's own face/status in the view of others.","",3,12,NA,NA,NA,NA,18,16,NA,10,5,4,NA,NA,11,NA,13,NA,NA,14,8,17,2,NA,NA,7,NA,1,NA,NA,NA,15,6,NA,NA,9
2024-02-13 08:04:17,2024-02-13 08:49:34,0,100,2717,1,2024-02-13 08:49:34,"R_2tfhlNi9whdk8Gp","anonymous","EN",1,NA,"Austria",2,"German",2,2,2,"I was first confused about the word ""FACE"". I thought it is more about beauty and not about preserving one's own face and status. Maybe rename the short abbreviation of the facet to ""STATUS"" (instead of FACE)?",4,4,1,1,4,1,4,4,1,1,4,1,NA,NA,NA,NA,NA,NA,2,4,1,2,3,1,2,4,1,2,5,1,NA,NA,NA,NA,NA,NA,NA,NA,NA,6,3,1,4,4,1,NA,NA,NA,5,4,1,NA,NA,NA,NA,NA,NA,NA,NA,NA,NA,NA,NA,NA,NA,NA,4,2,1,6,4,1,1,2,1,6,4,1,NA,NA,NA,NA,NA,NA,NA,NA,NA,4,3,1,NA,NA,NA,2,4,3,6,4,1,NA,NA,NA,NA,NA,NA,NA,NA,NA,"People should make decisions based on their own opinions and not based on what others think
It is more about decision-making. We, as people, cannot do what we want. We are very much constrained by the law or some other rules, regardless of whether it aligns with our values.","I think the items should have the same structure. 4/6 items start with ""people"". So maybe better to have this structure for the rest of the items as well. 
How about measuring 'self-concerns' from the first-person perspective? For example, ""my sense of worth should not depend on what others think of me"".","","","","Some of the items I would categorize as ""other concern"". Again, I am suggesting measuring 'self-concerns' from the first-person perspective","""Men should protect the reputation of women they are related to"" - is a very much a cultural thing (in muslim cultures). So better to take it out. 
A person cannot be respected if they are not true to their word - more about self-concern
A person cannot be respected if they are not loyal to their family- more about self-concern","","""People should know what is expected of them and act accordingly""
and ""People worthy of respect are those who do what is expected of them and do it well""
Are almost identical. Consider removing one of the items","","","Maybe change ""people"" to ""a group of people belonging together""",11,18,5,8,NA,NA,17,14,16,10,NA,NA,NA,13,2,NA,1,NA,NA,NA,NA,NA,12,7,9,6,NA,NA,NA,3,NA,4,15,NA,NA,NA
2024-02-13 08:32:19,2024-02-13 09:02:27,0,100,1808,1,2024-02-13 09:02:29,"R_47NyWLCGAOhyOSn","anonymous","EN",1,NA,"Serbia",2,"Serbian",2,2,2,"",1,4,1,1,4,2,NA,NA,NA,1,4,1,NA,NA,NA,1,4,1,2,3,1,6,4,1,2,3,1,2,4,1,NA,NA,NA,NA,NA,NA,NA,NA,NA,NA,NA,NA,NA,NA,NA,NA,NA,NA,1,3,1,1,4,1,NA,NA,NA,NA,NA,NA,NA,NA,NA,6,4,1,NA,NA,NA,NA,NA,NA,NA,NA,NA,NA,NA,NA,NA,NA,NA,5,4,1,5,4,1,5,4,1,6,4,1,NA,NA,NA,NA,NA,NA,4,3,1,4,4,1,6,3,1,"Item number 2. I think it partly captures self-assertion, i. e. honor.","","Item number 2, in my opinion, captures Face, i.e. endangering others' face and status.","","","","I would say that Item number 4 is more related to Face; other-focused honor is defined as protection of in-group's reputation. This is more a matter of relationship with out-group.  
Item number 6 is, in my opinion, more self-concern than other-concern honor.","","","","","",13,8,NA,4,NA,16,3,14,6,5,NA,NA,NA,NA,NA,NA,1,15,NA,NA,NA,11,NA,NA,NA,NA,NA,2,12,18,9,NA,NA,7,10,17
2024-02-13 09:17:54,2024-02-13 09:45:08,0,100,1633,1,2024-02-13 09:45:08,"R_1iCkmXJUFrRUH4j","anonymous","EN",1,NA,"china",2,"chinese",3,4,4,"",NA,NA,NA,NA,NA,NA,3,4,2,NA,NA,NA,1,4,2,NA,NA,NA,NA,NA,NA,NA,NA,NA,NA,NA,NA,NA,NA,NA,4,3,2,2,5,2,3,4,2,1,3,2,3,4,1,5,3,2,NA,NA,NA,NA,NA,NA,4,4,2,4,4,2,4,4,1,NA,NA,NA,4,4,1,1,4,2,2,4,1,5,4,1,5,4,2,NA,NA,NA,NA,NA,NA,NA,NA,NA,NA,NA,NA,6,3,2,6,4,2,NA,NA,NA,NA,NA,NA,NA,NA,NA,"","","3; This statement relates more to the concept of honesty and less emphasis on self-esteem","","","","","","","","","",NA,NA,11,NA,14,NA,NA,NA,NA,NA,6,4,9,17,18,5,NA,NA,12,8,3,NA,1,16,13,15,7,NA,NA,NA,NA,10,2,NA,NA,NA
2024-02-13 09:47:58,2024-02-13 10:17:25,0,100,1766,1,2024-02-13 10:17:26,"R_4CIKI2OMKx1mjgG","anonymous","EN",1,NA,"Turkey & United Kingdom",2,"Turkish",5,3,4,"",NA,NA,NA,4,3,3,NA,NA,NA,NA,NA,NA,2,3,2,NA,NA,NA,NA,NA,NA,NA,NA,NA,2,3,1,2,3,2,NA,NA,NA,2,3,2,NA,NA,NA,3,4,2,NA,NA,NA,4,4,2,NA,NA,NA,6,4,2,4,4,2,NA,NA,NA,4,4,2,4,4,1,4,4,2,NA,NA,NA,NA,NA,NA,4,2,2,4,3,2,6,4,1,4,3,2,5,4,2,NA,NA,NA,NA,NA,NA,NA,NA,NA,NA,NA,NA,6,3,2,NA,NA,NA,"Item 3: I know all the items will somewhat negatively correlated with other logics (e.g. honor); but I feel like this item will have strng negative correlation with honor due its nature on ""standing up"", and this make analysis complicated.","","","","Item 3: Potential ceiling effect. Hard to have enough variance (both within and between logics)","","Item 2: I believe defending a friend and family have different dynamics. Defending family is an unquestioned act but defending a friend is selective/conditional in terms of honor. Depending on the content and context, defending a friend can be a dishonorable act.","","","","","",NA,1,NA,NA,5,NA,NA,NA,6,10,NA,4,NA,18,NA,14,NA,3,17,NA,16,13,8,NA,NA,11,12,9,2,7,NA,NA,NA,NA,15,NA
2024-02-13 10:12:49,2024-02-13 10:41:45,0,100,1735,1,2024-02-13 10:41:45,"R_23EHpyOJu5d9Bus","anonymous","EN",1,NA,"Austria",2,"German",2,3,2,"None.",5,4,2,NA,NA,NA,3,3,2,3,4,2,NA,NA,NA,1,4,2,6,4,2,2,4,1,NA,NA,NA,NA,NA,NA,4,3,3,NA,NA,NA,4,5,1,NA,NA,NA,3,5,1,NA,NA,NA,3,4,2,NA,NA,NA,NA,NA,NA,4,5,1,NA,NA,NA,NA,NA,NA,NA,NA,NA,3,4,2,6,4,2,NA,NA,NA,NA,NA,NA,NA,NA,NA,NA,NA,NA,NA,NA,NA,2,4,1,6,4,1,6,5,1,6,4,2,NA,NA,NA,6,5,1,"rather item #5","","rather item #6","","item #4: Not responding to an insult might be also seen in some cultures as a strong position (Japan?)","","#4 is gender-specific. Some participants might see this different - see also the concept of benevolent sexism.
","","rather #5: the word 'responsibilities' is for me rather unspecific","","would rather avoid very strong words such as 'extremely' or 'never'","",8,NA,7,5,NA,2,16,1,NA,NA,4,NA,13,NA,12,NA,14,NA,NA,18,NA,NA,NA,3,6,NA,NA,NA,NA,NA,11,9,17,10,NA,15
2024-02-13 10:37:39,2024-02-13 10:49:02,0,100,683,1,2024-02-13 10:49:02,"R_3RQFqnjxdtgduKJ","anonymous","EN",1,NA,"United Kingdom",1,"",3,3,3,"So in Egypt-some may state it is an honour culture, but it is more accurate it has all three categories. The problem is it differs depending on context and situation.
In Egyptian culture, often referred to as ""sharaf."" It's closely linked to personal dignity (""karama"") and revolves around notions of reputation, family lineage, and adhering to social norms. Maintaining honour involves upholding values like modesty, loyalty, hospitality, and respect for elders. Traditionally, a man's honour was linked to protecting women in his family, while female honour is often tied to concepts like virginity and chastity. However, it's important to acknowledge the problematic aspects of this interpretation, as it can lead to gender inequality and harmful practices like ""honour killings.""

While not as dominant as honour, ""face"" (wajh) holds significance in Egyptian society. It's about avoiding public shame and embarrassment, maintaining social standing, and preserving self-respect in front of others. This can manifest in ways like avoiding public criticism, offering hospitality even when struggling financially, and prioritizing group harmony over individual needs.

The concept of ""karama"" emphasizes personal dignity and self-worth. It's intertwined with honour but focuses more on individual respect and integrity. Egyptians value treating others with dignity, regardless of their social status, and expect the same treatment in return.
It is important we include points about social class, location such as urban vs. rural, individual upbringing, we need to discuss gender norms and potential negative implications, which people may ignore. So, it is important we include a final one asking people what do you think these definitions mean to make sure they understand how we understand it.",3,4,NA,NA,NA,NA,NA,NA,NA,NA,NA,NA,NA,NA,NA,NA,NA,NA,5,5,NA,NA,NA,NA,3,3,NA,4,5,NA,4,3,NA,NA,NA,NA,NA,NA,NA,4,3,NA,NA,NA,NA,1,2,NA,NA,NA,NA,4,3,NA,NA,NA,NA,NA,NA,NA,5,3,NA,2,2,NA,NA,NA,NA,3,5,NA,NA,NA,NA,1,4,NA,5,4,NA,NA,NA,NA,NA,NA,NA,NA,NA,NA,4,3,NA,4,5,NA,6,3,NA,NA,NA,NA,6,2,NA,3,4,NA,"How much a person respects themselves is far more important than how much others respect them

It is more about how people respect them that matters more and by focusing on the individual-implies that it is individualistic.","","","","","","","","","","","",8,NA,NA,NA,NA,NA,2,NA,3,14,18,NA,NA,5,NA,9,NA,1,NA,NA,13,7,NA,16,NA,12,10,NA,NA,NA,4,15,17,NA,6,11
2024-02-13 10:53:22,2024-02-13 11:48:28,0,100,3306,1,2024-02-13 11:48:29,"R_3OiWYClarjJR2ZI","anonymous","EN",1,NA,"Portugal",2,"Portuguese",2,2,2,"",NA,NA,NA,1,3,3,1,4,2,1,4,1,1,4,1,1,4,3,NA,NA,NA,2,3,1,NA,NA,NA,NA,NA,NA,NA,NA,NA,2,4,1,3,4,1,NA,NA,NA,2,3,1,NA,NA,NA,3,2,1,NA,NA,NA,4,3,2,4,4,3,NA,NA,NA,NA,NA,NA,4,4,2,NA,NA,NA,4,4,2,NA,NA,NA,NA,NA,NA,6,3,1,6,3,1,5,3,2,NA,NA,NA,NA,NA,NA,NA,NA,NA,4,3,1,NA,NA,NA,NA,NA,NA,"I'm not so sure about English, but in other languages the use of the word ""people"" refers to others, thereby preventing the self-referential sense.","Please see comment above.","Keeping promises also has a lot to do with reputation and individual honor.","","Who are ""they"" in the sentence ""If a person is insulted and they don?t respond, they will look weak""?
Also, please see comment on the use of ""people"" when measuring self-related attributes.","","Who are ""they"" in the sentence ""If a person?s friend?s reputation is questioned, they should come to their defense""?
The sentence ""Men should protect the reputation of women they are related to"" is not gender-neutral. Should be avoided or rephrased.","","Please see previous comment regarding the word ""people"".","","","",NA,3,17,7,12,5,NA,14,NA,NA,NA,13,8,NA,16,NA,10,NA,11,15,NA,NA,4,NA,18,NA,NA,2,1,9,NA,NA,NA,6,NA,NA
2024-02-13 11:24:58,2024-02-13 11:55:13,0,100,1814,1,2024-02-13 11:55:14,"R_4w0vPIRur7i1F4D","anonymous","EN",1,NA,"India",2,"Hindi",4,3,4,"",NA,NA,NA,1,5,1,NA,NA,NA,1,5,1,NA,NA,NA,1,5,1,NA,NA,NA,NA,NA,NA,2,3,1,NA,NA,NA,2,3,2,2,5,2,NA,NA,NA,3,4,1,NA,NA,NA,3,4,1,3,4,1,NA,NA,NA,4,5,1,NA,NA,NA,NA,NA,NA,NA,NA,NA,4,4,1,3,3,1,NA,NA,NA,5,4,2,5,5,1,NA,NA,NA,NA,NA,NA,NA,NA,NA,3,3,2,NA,NA,NA,6,4,1,NA,NA,NA,6,4,1,6,4,1,"","Here is a suggestion for an additional statement-
1. People?s worth is independent of how others treat them.
","These items are good but I am thinking if items 1, 2, 3, and 5 can also overlap with the concept of moral honor. And item 4 can overlap with self concern, unless we say 'We should treat others with self-respect, no matter who they are' which makes the direction from us to others clear.","The sixth item very well represents this dimension. Here are some suggestions for items like the sixth one - 
1. People should accept the diverse identities that others hold, even if they don't align with their own.
2. People should acknowledge the feelings of others, even when they feel differently. 
3. People should consider what others think and feel before forming their own opinions about others.   
 4. People should acknowledge the decisions of others even if they do not agree to them. 
5. People should acknowledge the opinions of others even if they are not in line with their own.
","","","All items are good, but I am thinking for item 6, if it overlaps with honor, self-concern.","","","","I am not so sure of item 1, and am thinking it could overlap with face, self-concern, since all other items suggest what people should 'do' to keep harmony and good relationships. But item 1 suggests what people should 'be' in order to keep relations intact. So that could also be one of the expectations and similar to the items of self-concern, which also suggest that people should know what is expected of them.","",NA,3,NA,15,NA,13,NA,NA,17,NA,8,5,NA,4,NA,1,16,NA,2,NA,NA,NA,9,18,NA,7,11,NA,NA,NA,10,NA,14,NA,6,12
2024-02-13 11:47:38,2024-02-13 12:05:28,0,100,1070,1,2024-02-13 12:05:28,"R_2Wp28YFhFE16kDv","anonymous","EN",1,NA,"Serbia",2,"Serbian",2,2,2,"",3,4,1,3,5,1,NA,NA,NA,NA,NA,NA,NA,NA,NA,NA,NA,NA,4,3,1,NA,NA,NA,4,3,1,NA,NA,NA,3,2,1,NA,NA,NA,4,3,1,3,4,1,NA,NA,NA,NA,NA,NA,2,4,1,2,4,1,NA,NA,NA,2,3,1,NA,NA,NA,5,2,1,NA,NA,NA,3,4,1,6,5,1,5,2,1,NA,NA,NA,NA,NA,NA,NA,NA,NA,5,5,1,NA,NA,NA,NA,NA,NA,NA,NA,NA,6,3,1,6,3,1,2,5,1,"","","","","","To be honest. the distinction between dignity and honor was not clear to me based on provided description. For example, item A person must show strength to be respected seems more like dignity to me, than honor.","","Considering that face couture is defined by social roles, I assumed that item Men should protect the reputation of women they are related to is more in line with face, than honor.","","People should avoid situations where they could be embarrassed - seems like it is more dignity than face...","","",8,14,NA,NA,NA,NA,15,NA,9,NA,13,NA,3,6,NA,NA,1,18,NA,16,NA,7,NA,2,4,12,NA,NA,NA,17,NA,NA,NA,11,10,5
2024-02-13 11:46:05,2024-02-13 12:06:18,0,100,1213,1,2024-02-13 12:06:18,"R_8HBObIV40Fi6lvd","anonymous","EN",1,NA,"Poland",2,"Polish",3,2,2,"One element of the ""other-concern"" definition, i.e., ""universalistic morality"" may not be very clear to regular survey respondents",NA,NA,NA,NA,NA,NA,1,4,1,1,4,1,1,4,1,1,4,1,NA,NA,NA,2,3,1,NA,NA,NA,2,5,1,NA,NA,NA,1,4,1,NA,NA,NA,NA,NA,NA,3,3,1,3,3,1,NA,NA,NA,NA,NA,NA,4,5,1,NA,NA,NA,6,5,1,NA,NA,NA,6,4,1,NA,NA,NA,NA,NA,NA,NA,NA,NA,5,4,1,5,5,1,3,2,1,NA,NA,NA,3,3,1,5,2,2,5,4,1,NA,NA,NA,NA,NA,NA,NA,NA,NA,"All items seem fine","","I am not fully convinced to item number 5 (People should keep the secrets they have been trusted with, no matter whose secret it is). It seems a long stretch from the definition - I like item number 1 much more.","Perhaps the item ""People should never talk about others behind their back in a negative way"" could be extended to ""People should never talk about others behind their back in a negative way,  no matter who that person is""","Item number 3 (A person who has no honor is not worthy of respect) seems very abstract and repetitive.","","Item number 4 (Men should protect the reputation of women they are related to) is quite sexist","The item I mentioned above could be changed to ""People should protect the reputation of others they are related to""","Items 2 and 4 sound very similar, same with items 3 and 6","","","",NA,NA,14,11,12,13,NA,6,NA,10,NA,17,NA,NA,15,2,NA,NA,5,NA,16,NA,9,NA,NA,NA,7,1,8,NA,18,3,4,NA,NA,NA
2024-02-13 12:03:27,2024-02-13 12:16:59,0,100,812,1,2024-02-13 12:17:01,"R_47jMztvvIlj88tN","anonymous","EN",1,NA,"Thailand",2,"Thai",4,4,4,"",NA,NA,NA,1,4,2,1,4,2,NA,NA,NA,NA,NA,NA,NA,NA,NA,NA,NA,NA,NA,NA,NA,NA,NA,NA,1,4,2,NA,NA,NA,3,3,2,3,4,2,3,4,2,1,4,2,NA,NA,NA,NA,NA,NA,1,4,2,4,4,2,NA,NA,NA,6,4,2,4,4,2,4,4,2,NA,NA,NA,2,4,2,5,4,2,NA,NA,NA,NA,NA,NA,NA,NA,NA,1,4,2,2,3,4,NA,NA,NA,NA,NA,NA,6,4,2,6,4,2,NA,NA,NA,"","","","","","","","","","","","",NA,11,7,NA,NA,NA,NA,NA,NA,18,NA,14,9,6,10,NA,NA,2,16,NA,5,3,8,NA,13,12,NA,NA,NA,17,1,NA,NA,4,15,NA
2024-02-13 12:10:26,2024-02-13 12:58:00,0,100,2853,1,2024-02-13 12:58:02,"R_42FBriwRxs976s1","anonymous","EN",1,NA,"Russia",2,"Russian",5,5,5,"",1,5,1,1,5,1,NA,NA,NA,NA,NA,NA,2,4,1,NA,NA,NA,NA,NA,NA,NA,NA,NA,2,3,1,2,3,2,2,3,2,2,5,2,NA,NA,NA,3,5,1,3,4,3,3,5,1,3,5,1,NA,NA,NA,NA,NA,NA,4,4,3,NA,NA,NA,NA,NA,NA,6,5,1,3,5,1,6,5,3,NA,NA,NA,NA,NA,NA,NA,NA,NA,5,4,1,NA,NA,NA,NA,NA,NA,5,5,1,6,5,1,NA,NA,NA,NA,NA,NA,NA,NA,NA,"","","","","","","","","","","","",11,2,NA,NA,15,NA,NA,NA,17,7,6,5,NA,18,8,14,12,NA,NA,4,NA,NA,13,9,16,NA,NA,NA,3,NA,NA,1,10,NA,NA,NA
2024-02-13 12:40:02,2024-02-13 13:09:02,0,100,1740,1,2024-02-13 13:09:03,"R_7qW4eQxpX4x3kYH","anonymous","EN",1,NA,"GREECE",2,"Greek",3,3,3,"",NA,NA,NA,NA,NA,NA,1,4,1,1,5,NA,NA,NA,NA,1,5,1,1,4,1,2,4,1,NA,NA,NA,NA,NA,NA,NA,NA,NA,NA,NA,NA,3,5,1,NA,NA,NA,NA,NA,NA,NA,NA,NA,NA,NA,NA,2,4,1,4,5,1,NA,NA,NA,4,5,1,4,5,1,NA,NA,NA,NA,NA,NA,NA,NA,NA,6,5,1,1,4,1,5,4,1,NA,NA,NA,6,5,1,6,5,1,NA,NA,NA,NA,NA,NA,6,4,1,4,4,1,6,4,1,"","","","","","","","","","","","",NA,NA,5,8,NA,11,16,2,NA,NA,NA,NA,15,NA,NA,NA,NA,14,6,NA,4,18,NA,NA,NA,13,1,7,NA,10,12,NA,NA,17,9,3
2024-02-13 11:20:46,2024-02-13 13:14:46,0,100,6839,1,2024-02-13 13:14:46,"R_4tKBCFVheU6qPu3","anonymous","EN",1,NA,"Türkiye / Turkey",2,"Turkish",3,2,1,"",1,5,1,NA,NA,NA,NA,NA,NA,1,4,1,1,4,2,1,5,2,2,4,2,3,2,1,2,4,2,NA,NA,NA,2,3,2,NA,NA,NA,NA,NA,NA,NA,NA,NA,NA,NA,NA,3,5,1,3,3,3,NA,NA,NA,NA,NA,NA,4,4,2,NA,NA,NA,NA,NA,NA,NA,NA,NA,3,4,1,NA,NA,NA,NA,NA,NA,3,4,2,5,3,1,3,4,1,NA,NA,NA,NA,NA,NA,2,1,2,6,4,2,NA,NA,NA,NA,NA,NA,6,4,1,"","","""People should not lie to others, no matter who they are."" I think it would be appropriate to remove this item. We all lie in our adult lives, even if it is very simple. Therefore, I think the article is too general. If we were working with young children it might make sense, but I think it would not be very functional when directed at adults.","","I think this item in particular is gender-sensitive. ""A person must show strength to be respected"" It is uncommon for a woman to show strength. A woman's reputation is about conforming to norms. I don't think power is a norm for women. Unfortunately, I don't have any revision for the item. I can only suggest removal.","","I don't think the item ""A person cannot be respected if they are not true to their word"" is appropriate for other-concern. The meaning of the item is to protect one's own honor, not to protect the reputation of others. Therefore I think it is more appropriate for self-concern.","","","","","",4,NA,NA,7,5,17,10,3,12,NA,18,NA,NA,NA,NA,13,15,NA,NA,9,NA,NA,NA,6,NA,NA,1,2,8,NA,NA,11,14,NA,NA,16
2024-02-13 13:27:49,2024-02-13 13:47:44,0,100,1194,1,2024-02-13 13:47:45,"R_6FPuj75bvutU7Lp","anonymous","EN",1,NA,"Austria",2,"German",2,2,2,"",NA,NA,NA,NA,NA,NA,NA,NA,NA,1,4,2,NA,NA,NA,NA,NA,NA,3,3,3,2,5,1,4,3,1,NA,NA,NA,3,4,2,2,5,1,3,5,1,3,5,1,NA,NA,NA,3,4,2,5,4,1,NA,NA,NA,NA,NA,NA,NA,NA,NA,NA,NA,NA,NA,NA,NA,NA,NA,NA,NA,NA,NA,NA,NA,NA,5,4,1,NA,NA,NA,5,5,1,NA,NA,NA,5,5,2,6,4,2,6,3,1,4,5,2,NA,NA,NA,2,5,2,4,3,1,"they all sound quite good to me","","","Using the word 'respect' rather triggers the 'honor' association for me","/","/","","bringing in other social dimensions (friendship/family/men and women) might capture other values in the answers, than the one's, this project is aiming for","/","/","/","/",NA,NA,NA,4,NA,NA,14,11,15,NA,18,8,7,2,NA,12,5,NA,NA,NA,NA,NA,NA,NA,NA,6,NA,9,NA,17,1,10,16,NA,13,3
2024-02-13 13:13:22,2024-02-13 13:58:36,0,100,2714,1,2024-02-13 13:58:38,"R_4cvVoowJGFRA5Ix","anonymous","EN",1,NA,"Korea",2,"Korean",3,5,5,"",1,5,2,1,4,2,1,4,2,NA,NA,NA,2,4,2,1,4,2,NA,NA,NA,NA,NA,NA,NA,NA,NA,2,4,2,NA,NA,NA,NA,NA,NA,NA,NA,NA,NA,NA,NA,3,4,2,NA,NA,NA,NA,NA,NA,1,3,2,3,4,2,4,4,2,4,4,2,3,4,2,5,4,2,1,4,2,5,4,2,NA,NA,NA,1,4,2,NA,NA,NA,1,4,2,NA,NA,NA,NA,NA,NA,NA,NA,NA,NA,NA,NA,5,4,2,NA,NA,NA,NA,NA,NA,"","","","","","","I don't know why items #6 and #7 are not considered as other-concern but not as self-concern. Also, most items seems to be also relevant to face.","","","","","",10,15,18,NA,14,9,NA,NA,NA,13,NA,NA,NA,NA,5,NA,NA,4,2,7,17,6,16,11,1,NA,3,NA,8,NA,NA,NA,NA,12,NA,NA
2024-02-13 13:40:44,2024-02-13 14:35:09,0,100,3265,1,2024-02-13 14:35:10,"R_7kF8xGHPiBrJA8E","anonymous","EN",1,NA,"Canada",1,"",2,1,2,"",3,4,NA,NA,NA,NA,NA,NA,NA,NA,NA,NA,1,2,NA,1,5,NA,2,4,NA,NA,NA,NA,NA,NA,NA,2,5,NA,3,4,NA,2,4,NA,3,4,NA,NA,NA,NA,NA,NA,NA,NA,NA,NA,3,3,NA,NA,NA,NA,NA,NA,NA,4,5,NA,NA,NA,NA,NA,NA,NA,NA,NA,NA,3,4,NA,4,4,NA,NA,NA,NA,3,4,NA,NA,NA,NA,NA,NA,NA,5,4,NA,NA,NA,NA,5,4,NA,6,4,NA,NA,NA,NA,4,4,NA,6,4,NA,"","","","","","Should there be consistency in reference to ""A person"" and ""People""? So each item says ""A person..."" or ""People"" rather than intermixing them?","I would drop item no. 4 because it refers to sex or gender of persons whereas the others do not. I would drop item no. 1 or no. 7. Retain items 2, 3, 5, and 6.","","","If consistency is needed, then revise item no. 5 to ""People...""","","Revision to item no. 2: People should be extremely careful not to embarrass others, especially if it is someone of a higher rank",18,NA,NA,NA,1,13,17,NA,NA,7,14,11,4,NA,NA,NA,2,NA,NA,6,NA,NA,NA,3,16,NA,9,NA,NA,8,NA,12,15,NA,10,5
2024-02-13 16:31:12,2024-02-13 17:21:06,0,100,2994,1,2024-02-13 17:21:07,"R_6v5L2OjM7TqC0Xh","anonymous","EN",1,NA,"Italy",2,"Italian",4,1,1,"",NA,NA,NA,5,3,2,1,3,2,1,4,2,NA,NA,NA,NA,NA,NA,NA,NA,NA,2,3,2,1,4,2,NA,NA,NA,NA,NA,NA,NA,NA,NA,NA,NA,NA,3,4,1,3,3,2,3,3,2,NA,NA,NA,6,3,2,4,4,2,NA,NA,NA,4,4,2,3,4,2,4,3,2,NA,NA,NA,NA,NA,NA,5,4,2,NA,NA,NA,5,4,3,5,2,3,NA,NA,NA,6,4,2,NA,NA,NA,NA,NA,NA,1,3,2,NA,NA,NA,NA,NA,NA,"I think that all the items are ok","Some reverse items could be included","I'm not sure about Item 5: ""People should keep the secrets they have been trusted with, no matter whose secret it is"". It might have some overlap with honor culture.","","Item 6: ""People should not expect respect from others if they did not earn it"" should not be used. It is too broad and overlaps with face culture","In item 3 ""has not honor"" could be confusing","Items 6, ""A person cannot be respected if they are not true to their word"", and 2 "", If a person?s friend?s reputation is questioned, they should come to their defence"", could be problematic. Item 2 because friends are not as close as a family or a woman a man is related to. Item 6 because ""are not are not true to their word"" is not absolute, is not necessarily tied to one's family, and is not always true in honor culture.","reverse items are missing","Item 4 ""People should avoid situations where they could be embarrassed"" could be too generic","","","",NA,11,10,13,NA,NA,NA,18,4,NA,NA,NA,NA,2,8,12,NA,14,17,NA,15,6,1,NA,NA,7,NA,3,5,NA,16,NA,NA,9,NA,NA
2024-02-13 17:44:55,2024-02-13 17:57:37,0,100,761,1,2024-02-13 17:57:37,"R_2J0BNtMuEF6IvSh","anonymous","EN",1,NA,"Germany",2,"German",2,2,2,"",NA,NA,NA,1,4,1,NA,NA,NA,NA,NA,NA,1,4,2,NA,NA,NA,NA,NA,NA,NA,NA,NA,3,5,1,1,5,1,3,3,1,1,4,1,NA,NA,NA,3,3,1,NA,NA,NA,3,4,1,NA,NA,NA,NA,NA,NA,4,3,1,4,4,1,NA,NA,NA,NA,NA,NA,NA,NA,NA,3,5,1,NA,NA,NA,5,5,1,NA,NA,NA,5,5,1,NA,NA,NA,5,4,1,5,5,1,NA,NA,NA,6,4,1,NA,NA,NA,4,4,1,6,5,1,"All seem to fit quite well (I'm not a native speaker though).","","6 is probably not as precise as the others. I would focus either on opinion OR lifestyle.","","All seem to fit quite well.","","4 is probably not ideal, because the responses may vary as a function of the person's gender.","","All seem to fit quite well.","","All seem to fit quite well (I'm not a native speaker though).","",NA,11,NA,NA,7,NA,NA,NA,17,9,8,4,NA,14,NA,16,NA,NA,13,2,NA,NA,NA,12,NA,5,NA,10,NA,6,18,NA,1,NA,15,3
2024-02-13 19:54:49,2024-02-13 20:09:57,0,100,908,1,2024-02-13 20:09:58,"R_45KhVsvqy6xBDoa","anonymous","EN",1,NA,"Singapore",1,"",3,3,3,"",1,3,NA,NA,NA,NA,3,4,NA,1,4,NA,NA,NA,NA,1,4,NA,2,3,NA,2,4,NA,NA,NA,NA,NA,NA,NA,NA,NA,NA,NA,NA,NA,3,3,NA,NA,NA,NA,3,3,NA,NA,NA,NA,3,5,NA,3,3,NA,NA,NA,NA,NA,NA,NA,4,4,NA,4,4,NA,6,4,NA,NA,NA,NA,4,2,NA,NA,NA,NA,5,5,NA,NA,NA,NA,5,4,NA,NA,NA,NA,NA,NA,NA,6,3,NA,NA,NA,NA,6,3,NA,NA,NA,NA,NA,NA,NA,"","","","","","","","","","","","",18,NA,12,2,NA,5,9,8,NA,NA,NA,NA,7,NA,3,NA,15,6,NA,NA,1,14,10,NA,17,NA,13,NA,11,NA,NA,4,NA,16,NA,NA
2024-02-13 20:28:10,2024-02-13 21:09:54,0,100,2504,1,2024-02-13 21:09:55,"R_41btSezEeA4tgkh","anonymous","EN",1,NA,"Hungary",2,"Hungarian",3,3,3,"",1,3,1,5,3,2,1,3,1,NA,NA,NA,1,3,1,NA,NA,NA,6,4,1,6,3,1,NA,NA,NA,NA,NA,NA,NA,NA,NA,NA,NA,NA,NA,NA,NA,3,3,1,NA,NA,NA,NA,NA,NA,NA,NA,NA,2,4,1,4,4,1,4,4,1,4,4,1,NA,NA,NA,4,4,1,1,4,1,2,4,1,NA,NA,NA,NA,NA,NA,NA,NA,NA,3,4,1,NA,NA,NA,NA,NA,NA,2,3,1,NA,NA,NA,3,3,1,NA,NA,NA,4,4,1,"","","","","I am not sure that these items measure what is the definition of honor right now. Other than the need for defending the reputation, these items reflect on the nature/values of the tools of that defence.","","","","","","","",7,5,13,NA,16,NA,6,15,NA,NA,NA,NA,NA,9,NA,NA,NA,17,10,12,14,NA,3,11,4,NA,NA,NA,2,NA,NA,8,NA,18,NA,1
